<?xml version="1.0"?>

<Template name="Chilli's" author="ChilliAxe and Haven King" width="3288"
          height="4488"
          xmlns:xsi="http://www.w3.org/2001/XMLSchema-instance"
          xsi:noNamespaceSchemaLocation="template.xsd">
    <options>
        <Enumeration id="border" default="black">
            <EnumerationValue value="black"/>
            <EnumerationValue value="gold" id="gold"/>
            <EnumerationValue value="silver"/>
            <EnumerationValue value="none"/>
        </Enumeration>
        <ToggleOption id="bottom_text_outline" default="false"/>
        <ToggleOption id="copyright" default="true"/>
        <ToggleOption id="flavor_text" default="true"/>
        <ToggleOption id="flavor_bar" default="true"/>
    </options>
    <condition_definitions>
        <ConditionDefinition name="colorless_artifact">
            <IsPresent key="proximity.types.artifact"/>
            <IsEquals key="proximity.color_count" value="0"/>
        </ConditionDefinition>
        <ConditionDefinition name="one_or_two_colors">
            <Range key="proximity.color_count" min="1" max="2"/>
        </ConditionDefinition>
    </condition_definitions>
    <layers>
        <!-- The art layer is special in that it can also contain a width and/or height
        If both are provided, the layer will be stretched or shrunk to cover that area
        If only one is provided, the layer will be stretched or shrunk to fit that dimension
        while keeping the image proportional with its original dimensions -->
        <ArtLayer x="352" y="605" width="2584" height="1882">
            <conditions>
                <IsEquals key="proximity.options.use_official_art"/>
            </conditions>
        </ArtLayer>
        <Selector id="backgrounds">
            <Selector id="nyx">
                <ImageLayer id="artifact">
                    <conditions>
                        <IsPresent key="proximity.types.artifact"/>
                    </conditions>
                </ImageLayer>
                <ImageLayer id="colorless">
                    <conditions>
                        <IsEquals key="proximity.color_count" value="0"/>
                    </conditions>
                </ImageLayer>
                <ImageLayer id="colored" src="${colors}">
                    <conditions>
                        <IsEquals key="proximity.color_count" value="1"/>
                    </conditions>
                </ImageLayer>
                <ImageLayer id="gold"/>
                <conditions>
                    <IsPresent key="frame_effects.nyxtouched"/>
                </conditions>
            </Selector>
            <Selector id="standard">
                <ImageLayer id="vehicle">
                    <conditions>
                        <IsPresent key="proximity.types.vehicle"/>
                    </conditions>
                </ImageLayer>
                <ImageLayer id="artifact">
                    <conditions>
                        <IsPresent key="proximity.types.artifact"/>
                        <IsPresent key="proximity.types.land" value="false"/>
                    </conditions>
                </ImageLayer>
                <ImageLayer id="land">
                    <conditions>
                        <IsPresent key="proximity.types.land"/>
                    </conditions>
                </ImageLayer>
                <ImageLayer id="colored" src="${colors}">
                    <conditions>
                        <Or>
                            <IsEquals key="proximity.color_count" value="1"/>
                            <And>
                                <IsEquals key="proximity.color_count" value="2"/>
                                <IsEquals key="proximity.hybrid"/>
                            </And>
                        </Or>
                    </conditions>
                </ImageLayer>
                <ImageLayer id="gold">
                    <conditions>
                        <Range key="proximity.color_count" min="2"/>
                    </conditions>
                </ImageLayer>
            </Selector>
            <conditions>
                <Not>
                    <IsEquals key="proximity.options.border" value="none"/>
                </Not>
            </conditions>
        </Selector>
        <Selector id="shadows">
            <ImageLayer id="legendary">
                <conditions>
                    <IsPresent key="proximity.types.legendary"/>
                </conditions>
            </ImageLayer>
            <ImageLayer id="mdfc">
                <conditions>
                    <IsEquals key="layout" value="modal_dfc"/>
                </conditions>
            </ImageLayer>
            <ImageLayer id="transform">
                <conditions>
                    <IsEquals key="layout" value="transform"/>
                </conditions>
            </ImageLayer>
            <ImageLayer id="normal"/>
        </Selector>
        <Selector id="pinlines">
            <Fork id="modal">
                <Fork>
                    <Selector>
                        <ImageLayer id="artifact">
                            <conditions>
                                <IsEquals key="colorless_artifact"/>
                                <IsPresent key="proximity.types.land" value="false"/>
                            </conditions>
                        </ImageLayer>
                        <ImageLayer id="colorless">
                            <conditions>
                                <IsEquals key="proximity.color_count" value="0"/>
                            </conditions>
                        </ImageLayer>
                        <ImageLayer id="colored" src="${colors}">
                            <conditions>
                                <IsEquals key="one_or_two_colors"/>
                            </conditions>
                        </ImageLayer>
                        <ImageLayer id="gold"/>
                    </Selector>
                    <branches>
                        <Branch id="land">
                            <IsPresent key="proximity.types.land"/>
                        </Branch>
                        <Branch id="standard"/>
                    </branches>
                </Fork>
                <branches>
                    <Branch id="front">
                        <IsEquals key="proximity.front_face"/>
                    </Branch>
                    <Branch id="back">
                        <IsEquals key="proximity.front_face" value="false"/>
                    </Branch>
                </branches>
                <conditions>
                    <IsEquals key="layout" value="modal_dfc"/>
                </conditions>
            </Fork>
            <Fork id="transform">
                <Selector>
                    <ImageLayer id="artifact">
                        <conditions>
                            <IsEquals key="colorless_artifact"/>
                            <IsPresent key="proximity.types.land" value="false"/>
                        </conditions>
                    </ImageLayer>
                    <ImageLayer id="colorless">
                        <conditions>
                            <IsEquals key="proximity.color_count" value="0"/>
                        </conditions>
                    </ImageLayer>
                    <ImageLayer id="colored" src="${colors}">
                        <conditions>
                            <IsEquals key="one_or_two_colors"/>
                        </conditions>
                    </ImageLayer>
                    <ImageLayer id="gold"/>
                </Selector>
                <branches>
                    <Branch id="front">
                        <IsEquals key="proximity.front_face"/>
                    </Branch>
                    <Branch id="back">
                        <IsEquals key="proximity.front_face" value="false"/>
                    </Branch>
                </branches>
                <conditions>
                    <IsEquals key="layout" value="transform"/>
                </conditions>
            </Fork>
            <ImageLayer id="miracle" src="miracle/${colors}">
                <conditions>
                    <IsPresent key="frame_effects.miracle"/>
                    <IsEquals key="proximity.color_count" value="0"/>
                </conditions>
            </ImageLayer>
            <Selector id="mutate">
                <ImageLayer id="colorless">
                    <conditions>
                        <IsEquals key="colorless_artifact"/>
                        <IsPresent key="proximity.types.land" value="false"/>
                    </conditions>
                </ImageLayer>
                <ImageLayer id="colored">
                    <conditions>
                        <IsEquals key="one_or_two_colors"/>
                    </conditions>
                </ImageLayer>
                <ImageLayer id="gold"/>
                <conditions>
                    <IsPresent key="keywords.mutate"/>
                </conditions>
            </Selector>
            <Fork id="standard">
                <Selector>
                    <ImageLayer id="artifact">
                        <conditions>
                            <IsEquals key="colorless_artifact"/>
                            <IsPresent key="proximity.types.land" value="false"/>
                        </conditions>
                    </ImageLayer>
                    <ImageLayer id="colorless">
                        <conditions>
                            <IsEquals key="proximity.color_count" value="0"/>
                        </conditions>
                    </ImageLayer>
                    <ImageLayer id="colored" src="${colors}">
                        <conditions>
                            <IsEquals key="one_or_two_colors"/>
                        </conditions>
                    </ImageLayer>
                    <ImageLayer id="gold"/>